### ISSUE TITLE
Suricata reporting issues with Storj traffic

### ISSUE THREAD

**Issue by 1credit** [Storj/core#369]
### Package Versions

Replace the values below using the output from `npm list storj`. Use ```npm list -g storj``` if installed globally.

```
Storjshare:  6.0.1
Core:           3.0.4
Protocol:     0.8.0
```

Replace the values below using the output from `node --version`.

```
v4.4.7
```

### Expected Behavior

Clean network traffic

```

```

### Actual Behavior

Surricata logs pasted below, filtered on my Windows 7 GUI instance first drive port:

http://puu.sh/qQm01/59071ee656.png\

Similar reports for a linux CLI node port:

http://puu.sh/qQmaq/a5e57cb14c.png

And errors with my nodes connecting to bridge nodes:

http://puu.sh/qQn4F/a8761685f8.png

And finally, filtered on incoming traffic from the bridge nodes:

http://puu.sh/qQnhl/78ee9f4c5e.png
```

```

### Steps to Reproduce

Please include the steps the reproduce the issue, numbered below. Include as
much detail as possible.

1. Run a pfsense firewall
2. Activate Suricata
3. Observe logs

**Comment by littleskunk** [comment]
I debuged the kad communication and I see this:
`{\"access-control-allow-origin\":\"*\",\"access-control-allow-methods\":\"*\",\"access-control-allow-headers\":\"*\",\"access-control-allow-credentials\":\"true\",\"date\":\"Sun, 28 Aug 2016 20:35:13 GMT\",\"connection\":\"close\",\"content-length\":\"3115\"}`

Looks valid to me. Can you print out what the firewall received?

**Comment by 1credit** [comment]
I was pulling those reports from Alerts - will enable logging and see if more info is available.

**Comment by littleskunk** [comment]
I started wireshark. This is my first FIND_NODE message. Bug confirmed. Header is missing.

Frame 37: 587 bytes on wire (4696 bits), 587 bytes captured (4696 bits) on interface 0
Ethernet II, Src: Xensourc_5e:55:27 (00:16:3e:5e:55:27), Dst: fe:4e:68:b3:2f:55 (fe:4e:68:b3:2f:55)
Internet Protocol Version 4, Src: 10.0.3.41, Dst: 37.35.96.19
Transmission Control Protocol, Src Port: 48277 (48277), Dst Port: 5419 (5419), Seq: 1, Ack: 1, Len: 521
Hypertext Transfer Protocol
    POST / HTTP/1.1\r\n
        [Expert Info (Chat/Sequence): POST / HTTP/1.1\r\n]
            [POST / HTTP/1.1\r\n]
            [Severity level: Chat]
            [Group: Sequence]
        Request Method: POST
        Request URI: /
        Request Version: HTTP/1.1
    Host: server019.storj.dk:5419\r\n
    Connection: close\r\n
    Content-Length: 431\r\n
    \r\n
    [Full request URI: http://server019.storj.dk:5419/]
    [HTTP request 1/1]
    [Response in frame: 45]
    Data (431 bytes)

**Comment by bookchin** [comment]
@littleskunk what is the missing header?

**Comment by 1credit** [comment]
Thank you.  I suspect this, and any related mal-formed packets, is the source of the 1000s of incomplete sessions that have been reported, and potentially shy modem state tables are being overrun (still a theory).

**Comment by littleskunk** [comment]
wget www.google.de looks like this:
```
Frame 9: 177 bytes on wire (1416 bits), 177 bytes captured (1416 bits) on interface 0
Ethernet II, Src: Xensourc_5e:55:27 (00:16:3e:5e:55:27), Dst: fe:35:aa:e1:4f:22 (fe:35:aa:e1:4f:22)
Internet Protocol Version 4, Src: 10.0.3.41, Dst: 172.217.22.3
Transmission Control Protocol, Src Port: 58129 (58129), Dst Port: 80 (80), Seq: 1, Ack: 1, Len: 111
Hypertext Transfer Protocol
    GET / HTTP/1.1\r\n
        [Expert Info (Chat/Sequence): GET / HTTP/1.1\r\n]
        Request Method: GET
        Request URI: /
        Request Version: HTTP/1.1
    User-Agent: Wget/1.16 (linux-gnu)\r\n
    Accept: */*\r\n
    Host: www.google.de\r\n
    Connection: Keep-Alive\r\n
    \r\n
    [Full request URI: http://www.google.de/]
    [HTTP request 1/1]
    [Response in frame: 25]
```

We are sending valid HTTP Headers. 
```
    Host: server019.storj.dk:5419\r\n
    Connection: close\r\n
    Content-Length: 431\r\n
```
https://en.wikipedia.org/wiki/List_of_HTTP_header_fields
